{"id":"arc-challenge","version":1,"description":"AI2 Reasoning Challenge profile for broad science reasoning regression.","runner":"lm-eval","task":"arc_challenge","parameters":{"limit":100,"fewshot":0},"source":"https://github.com/EleutherAI/lm-evaluation-harness","license":"MIT","applicability":["reasoning","regression"],"required_for_promotion":false,"minimum_samples":100,"metrics":[{"id":"accuracy_norm","direction":"higher_is_better","target":0.55,"warning":0.45,"rationale":"Workspace starting band, not a universal quality threshold."}]}
