{"id":"arc-agi","version":1,"description":"ARC-AGI abstract reasoning profile using a separately installed, sandboxed runner and licensed task data.","runner":"arc-agi","task":"arc-agi","parameters":{"split":"evaluation","max_tasks":100},"source":"https://github.com/fchollet/ARC-AGI","license":"Apache-2.0","applicability":["abstract-reasoning","research"],"required_for_promotion":false,"minimum_samples":50,"metrics":[{"id":"task_success_rate","direction":"higher_is_better","target":0.2,"warning":0.1,"rationale":"Research-oriented workspace band; compare paired runs and disclose solver configuration."}]}
