{"id":"mmlu","version":1,"description":"Multi-task academic knowledge benchmark profile; use only for broad capability regression, not domain grounding.","runner":"lm-eval","task":"mmlu","parameters":{"limit":100,"fewshot":5},"source":"https://github.com/EleutherAI/lm-evaluation-harness","license":"MIT","applicability":["general-knowledge","regression"],"required_for_promotion":false,"minimum_samples":100,"metrics":[{"id":"accuracy","direction":"higher_is_better","target":0.6,"warning":0.5,"rationale":"Initial workspace band; calibrate by model size and domain before promotion use."}]}
